<?xml version="1.0" ?><sql:statement xmlns:sql="http://www.optimalbpm.se/XMLschema/DAL/SQL" xmlns:xsi="http://www.w3.org/2001/XMLSchema" xsi:schemaLocation="http://www.optimalbpm.se/XMLschema/DAL/SQL ../../SQL.xsd"><sql:Verb_CREATE_TABLE><sql:columns><sql:Parameter_ColumnDefinition><sql:datatype>serial</sql:datatype><sql:default/><sql:name>Table1ID</sql:name><sql:notnull>True</sql:notnull></sql:Parameter_ColumnDefinition><sql:Parameter_ColumnDefinition><sql:datatype>varchar(400)</sql:datatype><sql:default/><sql:name>Table1Name</sql:name><sql:notnull>False</sql:notnull></sql:Parameter_ColumnDefinition><sql:Parameter_ColumnDefinition><sql:datatype>timestamp</sql:datatype><sql:default>::currdatetime::</sql:default><sql:name>Table1Changed</sql:name><sql:notnull>False</sql:notnull></sql:Parameter_ColumnDefinition></sql:columns><sql:constraints><sql:Parameter_Constraint><sql:checkconditions/><sql:constraint_type>PRIMARY KEY</sql:constraint_type><sql:name>PK_Table1_Table1ID</sql:name><sql:references><sql:Parameter_Identifier><sql:identifier>Table1ID</sql:identifier><sql:operator>C</sql:operator><sql:prefix/></sql:Parameter_Identifier></sql:references></sql:Parameter_Constraint><sql:Parameter_Constraint><sql:checkconditions/><sql:constraint_type>FOREIGN KEY</sql:constraint_type><sql:name>FK_Table1_Table1ID_Table2_Table2ID</sql:name><sql:references><sql:Parameter_Identifier><sql:identifier>Table1ID</sql:identifier><sql:operator>C</sql:operator><sql:prefix/></sql:Parameter_Identifier><sql:Parameter_Identifier><sql:identifier>Table2</sql:identifier><sql:operator>C</sql:operator><sql:prefix/></sql:Parameter_Identifier><sql:Parameter_Identifier><sql:identifier>Table2ID</sql:identifier><sql:operator>C</sql:operator><sql:prefix/></sql:Parameter_Identifier></sql:references></sql:Parameter_Constraint><sql:Parameter_Constraint><sql:checkconditions><sql:Parameter_Condition><sql:and_or>AND</sql:and_or><sql:left><sql:Parameter_Numeric><sql:numeric_value>1.3</sql:numeric_value><sql:operator>+</sql:operator></sql:Parameter_Numeric></sql:left><sql:operator>&gt;</sql:operator><sql:right><sql:Parameter_Numeric><sql:numeric_value>2.4</sql:numeric_value><sql:operator>+</sql:operator></sql:Parameter_Numeric></sql:right></sql:Parameter_Condition><sql:Parameter_Condition><sql:and_or>AND</sql:and_or><sql:left><sql:Parameter_Identifier><sql:identifier>firstname</sql:identifier><sql:operator>C</sql:operator><sql:prefix>T1</sql:prefix></sql:Parameter_Identifier></sql:left><sql:operator>LIKE</sql:operator><sql:right><sql:Parameter_String><sql:escape_character/><sql:operator>+</sql:operator><sql:string_value>%icklas</sql:string_value></sql:Parameter_String></sql:right></sql:Parameter_Condition></sql:checkconditions><sql:constraint_type>CHECK</sql:constraint_type><sql:name>CK_Table1_Name</sql:name><sql:references><sql:Parameter_Identifier><sql:identifier>Table1ID</sql:identifier><sql:operator>C</sql:operator><sql:prefix/></sql:Parameter_Identifier></sql:references></sql:Parameter_Constraint><sql:Parameter_Constraint><sql:checkconditions/><sql:constraint_type>UNIQUE</sql:constraint_type><sql:name>UQ_Table1_Name</sql:name><sql:references><sql:Parameter_Identifier><sql:identifier>Table1ID</sql:identifier><sql:operator>C</sql:operator><sql:prefix/></sql:Parameter_Identifier></sql:references></sql:Parameter_Constraint></sql:constraints><sql:name>Table1</sql:name></sql:Verb_CREATE_TABLE></sql:statement>