<?xml version="1.0" ?><sql:statement xmlns:sql="http://www.optimalbpm.se/XMLschema/DAL/SQL" xmlns:xsi="http://www.w3.org/2001/XMLSchema" xsi:schemaLocation="http://www.optimalbpm.se/XMLschema/DAL/SQL ../../SQL.xsd"><sql:Verb_UPDATE><sql:assignments><sql:Parameter_Assignment><sql:left><sql:Parameter_Identifier><sql:identifier>dest_column</sql:identifier><sql:operator>C</sql:operator><sql:prefix/></sql:Parameter_Identifier></sql:left><sql:right><sql:Parameter_String><sql:escape_character/><sql:operator>C</sql:operator><sql:string_value>Hello</sql:string_value></sql:Parameter_String></sql:right></sql:Parameter_Assignment></sql:assignments><sql:conditions><sql:Parameter_Condition><sql:and_or>AND</sql:and_or><sql:left><sql:Parameter_Identifier><sql:identifier>col_1</sql:identifier><sql:operator>C</sql:operator><sql:prefix/></sql:Parameter_Identifier></sql:left><sql:operator>=</sql:operator><sql:right><sql:Parameter_String><sql:escape_character/><sql:operator>C</sql:operator><sql:string_value>1</sql:string_value></sql:Parameter_String></sql:right></sql:Parameter_Condition><sql:Parameter_Condition><sql:and_or>AND</sql:and_or><sql:left><sql:Parameter_Identifier><sql:identifier>col_2</sql:identifier><sql:operator>C</sql:operator><sql:prefix/></sql:Parameter_Identifier></sql:left><sql:operator>=</sql:operator><sql:right><sql:Parameter_String><sql:escape_character/><sql:operator>C</sql:operator><sql:string_value>1</sql:string_value></sql:Parameter_String></sql:right></sql:Parameter_Condition></sql:conditions><sql:table_identifier><sql:Parameter_Identifier><sql:identifier/><sql:operator>C</sql:operator><sql:prefix/></sql:Parameter_Identifier></sql:table_identifier></sql:Verb_UPDATE></sql:statement>
