<sql:statement xmlns:sql="http://www.unifiedbpm.se/XMLschema/DAL/SQL" xmlns:xsi="http://www.w3.org/2001/XMLSchema" xsi:schemaLocation="http://www.unifiedbpm.se/XMLschema/DAL/SQL ../../dal/SQL.xsd">

	<sql:Verb_SELECT>
		<sql:order_by/>
		<sql:fields>
			<sql:Parameter_Field>
				<sql:alias></sql:alias>
				<sql:expression>
					<sql:Parameter_Identifier>
						<sql:identifier>table_postgresID</sql:identifier>
						<sql:prefix>PG</sql:prefix>
						<sql:operator></sql:operator>
					</sql:Parameter_Identifier>
				</sql:expression>
			</sql:Parameter_Field>
			<sql:Parameter_Field>
				<sql:alias></sql:alias>
				<sql:expression>
					<sql:Parameter_Identifier>
						<sql:identifier>table_mysqlID</sql:identifier>
						<sql:prefix>MY</sql:prefix>
						<sql:operator></sql:operator>
					</sql:Parameter_Identifier>
				</sql:expression>
			</sql:Parameter_Field>
			<sql:Parameter_Field>
				<sql:alias></sql:alias>
				<sql:expression>
					<sql:Parameter_Identifier>
						<sql:identifier>table_postgresName</sql:identifier>
						<sql:prefix>PG</sql:prefix>
						<sql:operator></sql:operator>
					</sql:Parameter_Identifier>
				</sql:expression>
			</sql:Parameter_Field>
			<sql:Parameter_Field>
				<sql:alias></sql:alias>
				<sql:expression>
					<sql:Parameter_Identifier>
						<sql:identifier>table_mysqlName</sql:identifier>
						<sql:prefix>MY</sql:prefix>
						<sql:operator></sql:operator>
					</sql:Parameter_Identifier>
				</sql:expression>
			</sql:Parameter_Field>
			<sql:Parameter_Field>
				<sql:alias></sql:alias>
				<sql:expression>
					<sql:Parameter_Identifier>
						<sql:identifier>file_csvName</sql:identifier>
						<sql:prefix>CSV</sql:prefix>
						<sql:operator></sql:operator>
					</sql:Parameter_Identifier>
				</sql:expression>
			</sql:Parameter_Field>
		</sql:fields>
		<sql:sources>
			<sql:Parameter_Source>
				<sql:conditions/>
				<sql:join_type>INNER</sql:join_type>
				<sql:alias>PG</sql:alias>
				<sql:expression>
					<sql:Parameter_Identifier>
						<sql:identifier>table_postgres</sql:identifier>
						<sql:prefix></sql:prefix>
						<sql:operator></sql:operator>
					</sql:Parameter_Identifier>
				</sql:expression>
				<sql:resource_uuid>{1D62083E-88F7-4442-920D-0B6CC59BA2FF}</sql:resource_uuid>
			</sql:Parameter_Source>
			<sql:Parameter_Source>
				<sql:conditions>
					<sql:Parameter_Condition>
						<sql:right>
							<sql:Parameter_Identifier>
								<sql:identifier>table_mysqlID</sql:identifier>
								<sql:prefix>MY</sql:prefix>
								<sql:operator></sql:operator>
							</sql:Parameter_Identifier>
						</sql:right>
						<sql:and_or>AND</sql:and_or>
						<sql:operator>=</sql:operator>
						<sql:left>
							<sql:Parameter_Identifier>
								<sql:identifier>table_postgresID</sql:identifier>
								<sql:prefix>PG</sql:prefix>
								<sql:operator></sql:operator>
							</sql:Parameter_Identifier>
						</sql:left>
					</sql:Parameter_Condition>
				</sql:conditions>
				<sql:join_type>INNER</sql:join_type>
				<sql:alias>MY</sql:alias>
				<sql:expression>
					<sql:Parameter_Identifier>
						<sql:identifier>table_mysql</sql:identifier>
						<sql:prefix></sql:prefix>
						<sql:operator></sql:operator>
					</sql:Parameter_Identifier>
				</sql:expression>
				<sql:resource_uuid>{DD34A233-47A6-4C16-A26F-195711B49B97}</sql:resource_uuid>
			</sql:Parameter_Source>
			<sql:Parameter_Source>
				<sql:conditions>
					<sql:Parameter_Condition>
						<sql:right>
							<sql:Parameter_Cast>
								<sql:datatype>integer</sql:datatype>
								<sql:expression>
									<sql:Parameter_Identifier>
										<sql:identifier>file_csvID</sql:identifier>
										<sql:prefix>CSV</sql:prefix>
										<sql:operator></sql:operator>
									</sql:Parameter_Identifier>
								</sql:expression>
								<sql:operator></sql:operator>
							</sql:Parameter_Cast>
						</sql:right>
						<sql:and_or>AND</sql:and_or>
						<sql:operator>=</sql:operator>
						<sql:left>
							<sql:Parameter_Identifier>
								<sql:identifier>table_postgresID</sql:identifier>
								<sql:prefix>PG</sql:prefix>
								<sql:operator></sql:operator>
							</sql:Parameter_Identifier>
						</sql:left>
					</sql:Parameter_Condition>
				</sql:conditions>
				<sql:join_type>INNER</sql:join_type>
				<sql:alias>CSV</sql:alias>
				<sql:expression>
					<sql:Parameter_NoSQL>
						<sql:data_source>Flatfile_Dataset</sql:data_source>
						<sql:operator></sql:operator>
						<sql:resource_uuid>{86470370-FF78-48A4-9759-A3BAE4EE22FE}</sql:resource_uuid>
					</sql:Parameter_NoSQL>
				</sql:expression>
			</sql:Parameter_Source>
		</sql:sources>
		<sql:top_limit>1</sql:top_limit>
		<sql:operator></sql:operator>
		<sql:resource_uuid>{1D62083E-88F7-4442-920D-0B6CC59BA2FF}</sql:resource_uuid>
	</sql:Verb_SELECT>
	<resources>
	
		<resource type="rdbms" uuid="{1D62083E-88F7-4442-920D-0B6CC59BA2FF}" caption="localhost_pg">
			<server>localhost</server>
			<db_type>PostgreSQL</db_type>
			<database>ubpmtest</database>		
			<username>ubpmuser</username>
			<password>test</password>
		</resource>
		<resource type="rdbms" uuid="{DD34A233-47A6-4C16-A26F-195711B49B97}" caption="localhost_mysql">
			<server>localhost</server>
			<db_type>MySQL</db_type>
			<database>ubpmtest</database>		
			<username>ubpmuser</username>
			<password>test</password>
		</resource>
		<resource type="flatfile" uuid="{86470370-FF78-48A4-9759-A3BAE4EE22FE}" caption="csv-file">
			<filename>resources/_test_SELECT_resource_csv_in.txt</filename>
			<delimiter>,</delimiter>
			<has_header>True</has_header>
			<csv_dialect>csv</csv_dialect>
		</resource>		
		
	</resources>

</sql:statement>